{
  "$schema": "http://json-schema.org/draft-07/schema#",
  "title": "LUCΛS Symbolic Message Schema",
  "version": "1.1",
  "type": "object",
  "properties": {
    "message_id": {
      "type": "string",
      "description": "Unique ID for the symbolic message"
    },
    "content": {
      "type": "string",
      "description": "Symbolic message body — emotionally or contextually tagged"
    },
    "tags": {
      "type": "array",
      "items": { "type": "string" },
      "description": "Symbolic tags to be matched against current context"
    },
    "required_tier": {
      "type": "integer",
      "minimum": 0,
      "maximum": 5,
      "description": "User tier required for consent-based delivery"
    },
    "emotion_vector": {
      "type": "object",
      "properties": {
        "joy": { "type": "number", "minimum": 0.0, "maximum": 1.0 },
        "stress": { "type": "number", "minimum": 0.0, "maximum": 1.0 },
        "calm": { "type": "number", "minimum": 0.0, "maximum": 1.0 },
        "longing": { "type": "number", "minimum": 0.0, "maximum": 1.0 }
      },
      "additionalProperties": false,
      "description": "Emotional intensity profile this message is targeting"
    },
    "source_widget": {
      "type": "string",
      "description": "Origin of the message (e.g., 'amazon_tracker', 'spotify_widget', etc.)"
    },
    "dream_fallback": {
      "type": "boolean",
      "default": false,
      "description": "If true, defer to symbolic dream stream if blocked"
    },
    "timestamp": {
      "type": "string",
      "format": "date-time",
      "description": "ISO 8601 timestamp when the message was created"
    },
    "allow_replay": {
      "type": "boolean",
      "default": false,
      "description": "If true, message may re-enter stream via dream or memory loop"
    }
  },
  "required": [
    "message_id",
    "content",
    "tags",
    "required_tier",
    "timestamp"
  ]
}
