{
  "message_id": "msg_2025_dream_01",
  "content": "ðŸŒŒ Tonightâ€™s dream reveals a forgotten memory of safety. Let it unfold softly.",
  "tags": ["dream", "memory", "safety", "soothe"],
  "required_tier": 1,
  "emotion_vector": {
    "joy": 0.6,
    "stress": 0.1,
    "calm": 0.9,
    "longing": 0.8
  },
  "source_widget": "sleep_overlay",
  "dream_fallback": false,
  "timestamp": "2025-04-16T23:00:00Z",
  "allow_replay": true
}
